Sheet: 383_fever_data
A1: name | B1: A | C1: E | D1: F | E1: T | F1: E and A | G1: E and F | H1: E and T | I1: not E and A | J1: not E and F | K1: not E and T | L1: F and A | M1: F and T | N1: not F and A | O1: not F and T | P1: E and A and T | Q1: A and T
A2: Shannon Rosales | B2: 1 | C2: 1 | D2: 0 | E2: 0 | F2: 1 | G2: 0 | H2: 0 | I2: 0 | J2: 0 | K2: 0 | L2: 0 | M2: 0 | N2: 1 | O2: 0 | P2: =IF(AND(RC[-14]=TRUE, RC[-13]=TRUE, RC[-12] =TRUE),TRUE,FALSE) -> 0 | Q2: =IF(AND(RC[-15]=TRUE,RC[-12]=TRUE),TRUE, FALSE) -> 0
A3: Lisa Jones | B3: 0 | C3: 0 | D3: 0 | E3: 0 | F3: 0 | G3: 0 | H3: 0 | I3: 0 | J3: 0 | K3: 0 | L3: 0 | M3: 0 | N3: 0 | O3: 0 | P3: =IF(AND(RC[-14]=TRUE, RC[-13]=TRUE, RC[-12] =TRUE),TRUE,FALSE) -> 0 | Q3: =IF(AND(RC[-15]=TRUE,RC[-12]=TRUE),TRUE, FALSE) -> 0
A4: Monica Blanchard | B4: 1 | C4: 0 | D4: 1 | E4: 1 | F4: 0 | G4: 1 | H4: 0 | I4: 1 | J4: 1 | K4: 1 | L4: 1 | M4: 1 | N4: 0 | O4: 0 | P4: =IF(AND(RC[-14]=TRUE, RC[-13]=TRUE, RC[-12] =TRUE),TRUE,FALSE) -> 0 | Q4: =IF(AND(RC[-15]=TRUE,RC[-12]=TRUE),TRUE, FALSE) -> 1
A5: Carl Bradley | B5: 0 | C5: 0 | D5: 0 | E5: 0 | F5: 0 | G5: 0 | H5: 0 | I5: 0 | J5: 0 | K5: 0 | L5: 0 | M5: 0 | N5: 0 | O5: 0 | P5: =IF(AND(RC[-14]=TRUE, RC[-13]=TRUE, RC[-12] =TRUE),TRUE,FALSE) -> 0 | Q5: =IF(AND(RC[-15]=TRUE,RC[-12]=TRUE),TRUE, FALSE) -> 0
A6: George Kennedy | B6: 0 | C6: 0 | D6: 0 | E6: 0 | F6: 0 | G6: 0 | H6: 0 | I6: 0 | J6: 0 | K6: 0 | L6: 0 | M6: 0 | N6: 0 | O6: 0 | P6: =IF(AND(RC[-14]=TRUE, RC[-13]=TRUE, RC[-12] =TRUE),TRUE,FALSE) -> 0 | Q6: =IF(AND(RC[-15]=TRUE,RC[-12]=TRUE),TRUE, FALSE) -> 0
A7: Craig Salinas | B7: 1 | C7: 1 | D7: 1 | E7: 1 | F7: 1 | G7: 1 | H7: 1 | I7: 0 | J7: 0 | K7: 0 | L7: 1 | M7: 1 | N7: 0 | O7: 0 | P7: =IF(AND(RC[-14]=TRUE, RC[-13]=TRUE, RC[-12] =TRUE),TRUE,FALSE) -> 1 | Q7: =IF(AND(RC[-15]=TRUE,RC[-12]=TRUE),TRUE, FALSE) -> 1
A8: Benjamin Chavez | B8: 0 | C8: 0 | D8: 0 | E8: 0 | F8: 0 | G8: 0 | H8: 0 | I8: 0 | J8: 0 | K8: 0 | L8: 0 | M8: 0 | N8: 0 | O8: 0 | P8: =IF(AND(RC[-14]=TRUE, RC[-13]=TRUE, RC[-12] =TRUE),TRUE,FALSE) -> 0 | Q8: =IF(AND(RC[-15]=TRUE,RC[-12]=TRUE),TRUE, FALSE) -> 0
A9: Laura Huber | B9: 0 | C9: 0 | D9: 0 | E9: 0 | F9: 0 | G9: 0 | H9: 0 | I9: 0 | J9: 0 | K9: 0 | L9: 0 | M9: 0 | N9: 0 | O9: 0 | P9: =IF(AND(RC[-14]=TRUE, RC[-13]=TRUE, RC[-12] =TRUE),TRUE,FALSE) -> 0 | Q9: =IF(AND(RC[-15]=TRUE,RC[-12]=TRUE),TRUE, FALSE) -> 0
A10: Jacob Maldonado | B10: 1 | C10: 1 | D10: 1 | E10: 1 | F10: 1 | G10: 1 | H10: 1 | I10: 0 | J10: 0 | K10: 0 | L10: 1 | M10: 1 | N10: 0 | O10: 0 | P10: =IF(AND(RC[-14]=TRUE, RC[-13]=TRUE, RC[-12] =TRUE),TRUE,FALSE) -> 1 | Q10: =IF(AND(RC[-15]=TRUE,RC[-12]=TRUE),TRUE, FALSE) -> 1
A11: Melissa Tucker | B11: 1 | C11: 0 | D11: 0 | E11: 0 | F11: 0 | G11: 0 | H11: 0 | I11: 1 | J11: 0 | K11: 0 | L11: 0 | M11: 0 | N11: 1 | O11: 0 | P11: =IF(AND(RC[-14]=TRUE, RC[-13]=TRUE, RC[-12] =TRUE),TRUE,FALSE) -> 0 | Q11: =IF(AND(RC[-15]=TRUE,RC[-12]=TRUE),TRUE, FALSE) -> 0
A12: Betty Hahn | B12: 1 | C12: 0 | D12: 0 | E12: 0 | F12: 0 | G12: 0 | H12: 0 | I12: 1 | J12: 0 | K12: 0 | L12: 0 | M12: 0 | N12: 1 | O12: 0 | P12: =IF(AND(RC[-14]=TRUE, RC[-13]=TRUE, RC[-12] =TRUE),TRUE,FALSE) -> 0 | Q12: =IF(AND(RC[-15]=TRUE,RC[-12]=TRUE),TRUE, FALSE) -> 0
A13: Ryan Parrish | B13: 1 | C13: 1 | D13: 1 | E13: 1 | F13: 1 | G13: 1 | H13: 1 | I13: 0 | J13: 0 | K13: 0 | L13: 1 | M13: 1 | N13: 0 | O13: 0 | P13: =IF(AND(RC[-14]=TRUE, RC[-13]=TRUE, RC[-12] =TRUE),TRUE,FALSE) -> 1 | Q13: =IF(AND(RC[-15]=TRUE,RC[-12]=TRUE),TRUE, FALSE) -> 1
A14: Kelly Phillips | B14: 0 | C14: 1 | D14: 1 | E14: 1 | F14: 0 | G14: 0 | H14: 1 | I14: 0 | J14: 0 | K14: 0 | L14: 0 | M14: 1 | N14: 0 | O14: 0 | P14: =IF(AND(RC[-14]=TRUE, RC[-13]=TRUE, RC[-12] =TRUE),TRUE,FALSE) -> 0 | Q14: =IF(AND(RC[-15]=TRUE,RC[-12]=TRUE),TRUE, FALSE) -> 0
A15: Ronald Avila | B15: 1 | C15: 1 | D15: 1 | E15: 1 | F15: 1 | G15: 1 | H15: 1 | I15: 0 | J15: 0 | K15: 0 | L15: 1 | M15: 1 | N15: 0 | O15: 0 | P15: =IF(AND(RC[-14]=TRUE, RC[-13]=TRUE, RC[-12] =TRUE),TRUE,FALSE) -> 1 | Q15: =IF(AND(RC[-15]=TRUE,RC[-12]=TRUE),TRUE, FALSE) -> 1
A16: Jose Stanton | B16: 1 | C16: 0 | D16: 0 | E16: 0 | F16: 0 | G16: 0 | H16: 0 | I16: 1 | J16: 0 | K16: 0 | L16: 0 | M16: 0 | N16: 1 | O16: 0 | P16: =IF(AND(RC[-14]=TRUE, RC[-13]=TRUE, RC[-12] =TRUE),TRUE,FALSE) -> 0 | Q16: =IF(AND(RC[-15]=TRUE,RC[-12]=TRUE),TRUE, FALSE) -> 0
A17: Leah Hernandez | B17: 1 | C17: 0 | D17: 1 | E17: 1 | F17: 0 | G17: 1 | H17: 0 | I17: 1 | J17: 1 | K17: 1 | L17: 1 | M17: 1 | N17: 0 | O17: 0 | P17: =IF(AND(RC[-14]=TRUE, RC[-13]=TRUE, RC[-12] =TRUE),TRUE,FALSE) -> 0 | Q17: =IF(AND(RC[-15]=TRUE,RC[-12]=TRUE),TRUE, FALSE) -> 1
A18: Jacob Thompson MD | B18: 0 | C18: 1 | D18: 0 | E18: 0 | F18: 0 | G18: 0 | H18: 0 | I18: 0 | J18: 0 | K18: 0 | L18: 0 | M18: 0 | N18: 0 | O18: 0 | P18: =IF(AND(RC[-14]=TRUE, RC[-13]=TRUE, RC[-12] =TRUE),TRUE,FALSE) -> 0 | Q18: =IF(AND(RC[-15]=TRUE,RC[-12]=TRUE),TRUE, FALSE) -> 0
A19: Brian Turner | B19: 0 | C19: 0 | D19: 0 | E19: 0 | F19: 0 | G19: 0 | H19: 0 | I19: 0 | J19: 0 | K19: 0 | L19: 0 | M19: 0 | N19: 0 | O19: 0 | P19: =IF(AND(RC[-14]=TRUE, RC[-13]=TRUE, RC[-12] =TRUE),TRUE,FALSE) -> 0 | Q19: =IF(AND(RC[-15]=TRUE,RC[-12]=TRUE),TRUE, FALSE) -> 0
A20: Benjamin Collins | B20: 0 | C20: 0 | D20: 0 | E20: 0 | F20: 0 | G20: 0 | H20: 0 | I20: 0 | J20: 0 | K20: 0 | L20: 0 | M20: 0 | N20: 0 | O20: 0 | P20: =IF(AND(RC[-14]=TRUE, RC[-13]=TRUE, RC[-12] =TRUE),TRUE,FALSE) -> 0 | Q20: =IF(AND(RC[-15]=TRUE,RC[-12]=TRUE),TRUE, FALSE) -> 0
A21: Eric Nelson | B21: 0 | C21: 0 | D21: 0 | E21: 0 | F21: 0 | G21: 0 | H21: 0 | I21: 0 | J21: 0 | K21: 0 | L21: 0 | M21: 0 | N21: 0 | O21: 0 | P21: =IF(AND(RC[-14]=TRUE, RC[-13]=TRUE, RC[-12] =TRUE),TRUE,FALSE) -> 0 | Q21: =IF(AND(RC[-15]=TRUE,RC[-12]=TRUE),TRUE, FALSE) -> 0
A22: Melissa Ray | B22: 0 | C22: 0 | D22: 0 | E22: 0 | F22: 0 | G22: 0 | H22: 0 | I22: 0 | J22: 0 | K22: 0 | L22: 0 | M22: 0 | N22: 0 | O22: 0 | P22: =IF(AND(RC[-14]=TRUE, RC[-13]=TRUE, RC[-12] =TRUE),TRUE,FALSE) -> 0 | Q22: =IF(AND(RC[-15]=TRUE,RC[-12]=TRUE),TRUE, FALSE) -> 0
A23: Jennifer Knapp | B23: 0 | C23: 0 | D23: 0 | E23: 0 | F23: 0 | G23: 0 | H23: 0 | I23: 0 | J23: 0 | K23: 0 | L23: 0 | M23: 0 | N23: 0 | O23: 0 | P23: =IF(AND(RC[-14]=TRUE, RC[-13]=TRUE, RC[-12] =TRUE),TRUE,FALSE) -> 0 | Q23: =IF(AND(RC[-15]=TRUE,RC[-12]=TRUE),TRUE, FALSE) -> 0
A24: Michael Butler | B24: 1 | C24: 1 | D24: 1 | E24: 1 | F24: 1 | G24: 1 | H24: 1 | I24: 0 | J24: 0 | K24: 0 | L24: 1 | M24: 1 | N24: 0 | O24: 0 | P24: =IF(AND(RC[-14]=TRUE, RC[-13]=TRUE, RC[-12] =TRUE),TRUE,FALSE) -> 1 | Q24: =IF(AND(RC[-15]=TRUE,RC[-12]=TRUE),TRUE, FALSE) -> 1
A25: Chelsea Smith | B25: 0 | C25: 0 | D25: 0 | E25: 0 | F25: 0 | G25: 0 | H25: 0 | I25: 0 | J25: 0 | K25: 0 | L25: 0 | M25: 0 | N25: 0 | O25: 0 | P25: =IF(AND(RC[-14]=TRUE, RC[-13]=TRUE, RC[-12] =TRUE),TRUE,FALSE) -> 0 | Q25: =IF(AND(RC[-15]=TRUE,RC[-12]=TRUE),TRUE, FALSE) -> 0
A26: Stephanie Watkins | B26: 0 | C26: 0 | D26: 0 | E26: 0 | F26: 0 | G26: 0 | H26: 0 | I26: 0 | J26: 0 | K26: 0 | L26: 0 | M26: 0 | N26: 0 | O26: 0 | P26: =IF(AND(RC[-14]=TRUE, RC[-13]=TRUE, RC[-12] =TRUE),TRUE,FALSE) -> 0 | Q26: =IF(AND(RC[-15]=TRUE,RC[-12]=TRUE),TRUE, FALSE) -> 0
A27: Jeremy Carroll | B27: 0 | C27: 1 | D27: 0 | E27: 0 | F27: 0 | G27: 0 | H27: 0 | I27: 0 | J27: 0 | K27: 0 | L27: 0 | M27: 0 | N27: 0 | O27: 0 | P27: =IF(AND(RC[-14]=TRUE, RC[-13]=TRUE, RC[-12] =TRUE),TRUE,FALSE) -> 0 | Q27: =IF(AND(RC[-15]=TRUE,RC[-12]=TRUE),TRUE, FALSE) -> 0
A28: Veronica Wolf | B28: 0 | C28: 0 | D28: 0 | E28: 0 | F28: 0 | G28: 0 | H28: 0 | I28: 0 | J28: 0 | K28: 0 | L28: 0 | M28: 0 | N28: 0 | O28: 0 | P28: =IF(AND(RC[-14]=TRUE, RC[-13]=TRUE, RC[-12] =TRUE),TRUE,FALSE) -> 0 | Q28: =IF(AND(RC[-15]=TRUE,RC[-12]=TRUE),TRUE, FALSE) -> 0
A29: John Smith | B29: 0 | C29: 0 | D29: 0 | E29: 0 | F29: 0 | G29: 0 | H29: 0 | I29: 0 | J29: 0 | K29: 0 | L29: 0 | M29: 0 | N29: 0 | O29: 0 | P29: =IF(AND(RC[-14]=TRUE, RC[-13]=TRUE, RC[-12] =TRUE),TRUE,FALSE) -> 0 | Q29: =IF(AND(RC[-15]=TRUE,RC[-12]=TRUE),TRUE, FALSE) -> 0
A30: Elizabeth Collins | B30: 1 | C30: 0 | D30: 0 | E30: 1 | F30: 0 | G30: 0 | H30: 0 | I30: 1 | J30: 0 | K30: 1 | L30: 0 | M30: 0 | N30: 1 | O30: 1 | P30: =IF(AND(RC[-14]=TRUE, RC[-13]=TRUE, RC[-12] =TRUE),TRUE,FALSE) -> 0 | Q30: =IF(AND(RC[-15]=TRUE,RC[-12]=TRUE),TRUE, FALSE) -> 1
A31: Robert Cunningham | B31: 0 | C31: 1 | D31: 0 | E31: 0 | F31: 0 | G31: 0 | H31: 0 | I31: 0 | J31: 0 | K31: 0 | L31: 0 | M31: 0 | N31: 0 | O31: 0 | P31: =IF(AND(RC[-14]=TRUE, RC[-13]=TRUE, RC[-12] =TRUE),TRUE,FALSE) -> 0 | Q31: =IF(AND(RC[-15]=TRUE,RC[-12]=TRUE),TRUE, FALSE) -> 0
A32: Scott Taylor | B32: 1 | C32: 0 | D32: 1 | E32: 1 | F32: 0 | G32: 1 | H32: 0 | I32: 1 | J32: 1 | K32: 1 | L32: 1 | M32: 1 | N32: 0 | O32: 0 | P32: =IF(AND(RC[-14]=TRUE, RC[-13]=TRUE, RC[-12] =TRUE),TRUE,FALSE) -> 0 | Q32: =IF(AND(RC[-15]=TRUE,RC[-12]=TRUE),TRUE, FALSE) -> 1
A33: Lauren Moore | B33: 0 | C33: 0 | D33: 0 | E33: 0 | F33: 0 | G33: 0 | H33: 0 | I33: 0 | J33: 0 | K33: 0 | L33: 0 | M33: 0 | N33: 0 | O33: 0 | P33: =IF(AND(RC[-14]=TRUE, RC[-13]=TRUE, RC[-12] =TRUE),TRUE,FALSE) -> 0 | Q33: =IF(AND(RC[-15]=TRUE,RC[-12]=TRUE),TRUE, FALSE) -> 0
A34: Richard Hardy | B34: 1 | C34: 0 | D34: 0 | E34: 0 | F34: 0 | G34: 0 | H34: 0 | I34: 1 | J34: 0 | K34: 0 | L34: 0 | M34: 0 | N34: 1 | O34: 0 | P34: =IF(AND(RC[-14]=TRUE, RC[-13]=TRUE, RC[-12] =TRUE),TRUE,FALSE) -> 0 | Q34: =IF(AND(RC[-15]=TRUE,RC[-12]=TRUE),TRUE, FALSE) -> 0
A35: Jared Brown | B35: 1 | C35: 1 | D35: 1 | E35: 1 | F35: 1 | G35: 1 | H35: 1 | I35: 0 | J35: 0 | K35: 0 | L35: 1 | M35: 1 | N35: 0 | O35: 0 | P35: =IF(AND(RC[-14]=TRUE, RC[-13]=TRUE, RC[-12] =TRUE),TRUE,FALSE) -> 1 | Q35: =IF(AND(RC[-15]=TRUE,RC[-12]=TRUE),TRUE, FALSE) -> 1
A36: Daniel Reyes | B36: 0 | C36: 0 | D36: 0 | E36: 0 | F36: 0 | G36: 0 | H36: 0 | I36: 0 | J36: 0 | K36: 0 | L36: 0 | M36: 0 | N36: 0 | O36: 0 | P36: =IF(AND(RC[-14]=TRUE, RC[-13]=TRUE, RC[-12] =TRUE),TRUE,FALSE) -> 0 | Q36: =IF(AND(RC[-15]=TRUE,RC[-12]=TRUE),TRUE, FALSE) -> 0
A37: Christine Thomas | B37: 0 | C37: 0 | D37: 0 | E37: 0 | F37: 0 | G37: 0 | H37: 0 | I37: 0 | J37: 0 | K37: 0 | L37: 0 | M37: 0 | N37: 0 | O37: 0 | P37: =IF(AND(RC[-14]=TRUE, RC[-13]=TRUE, RC[-12] =TRUE),TRUE,FALSE) -> 0 | Q37: =IF(AND(RC[-15]=TRUE,RC[-12]=TRUE),TRUE, FALSE) -> 0
A38: Kelly Forbes | B38: 0 | C38: 0 | D38: 0 | E38: 0 | F38: 0 | G38: 0 | H38: 0 | I38: 0 | J38: 0 | K38: 0 | L38: 0 | M38: 0 | N38: 0 | O38: 0 | P38: =IF(AND(RC[-14]=TRUE, RC[-13]=TRUE, RC[-12] =TRUE),TRUE,FALSE) -> 0 | Q38: =IF(AND(RC[-15]=TRUE,RC[-12]=TRUE),TRUE, FALSE) -> 0
A39: Stephen Miller | B39: 1 | C39: 0 | D39: 1 | E39: 1 | F39: 0 | G39: 1 | H39: 0 | I39: 1 | J39: 1 | K39: 1 | L39: 1 | M39: 1 | N39: 0 | O39: 0 | P39: =IF(AND(RC[-14]=TRUE, RC[-13]=TRUE, RC[-12] =TRUE),TRUE,FALSE) -> 0 | Q39: =IF(AND(RC[-15]=TRUE,RC[-12]=TRUE),TRUE, FALSE) -> 1
A40: Hayden Hughes | B40: 1 | C40: 0 | D40: 0 | E40: 0 | F40: 0 | G40: 0 | H40: 0 | I40: 1 | J40: 0 | K40: 0 | L40: 0 | M40: 0 | N40: 1 | O40: 0 | P40: =IF(AND(RC[-14]=TRUE, RC[-13]=TRUE, RC[-12] =TRUE),TRUE,FALSE) -> 0 | Q40: =IF(AND(RC[-15]=TRUE,RC[-12]=TRUE),TRUE, FALSE) -> 0
A41: Vicki Miller | B41: 0 | C41: 1 | D41: 0 | E41: 0 | F41: 0 | G41: 0 | H41: 0 | I41: 0 | J41: 0 | K41: 0 | L41: 0 | M41: 0 | N41: 0 | O41: 0 | P41: =IF(AND(RC[-14]=TRUE, RC[-13]=TRUE, RC[-12] =TRUE),TRUE,FALSE) -> 0 | Q41: =IF(AND(RC[-15]=TRUE,RC[-12]=TRUE),TRUE, FALSE) -> 0
A42: Roger Peterson | B42: 0 | C42: 0 | D42: 0 | E42: 0 | F42: 0 | G42: 0 | H42: 0 | I42: 0 | J42: 0 | K42: 0 | L42: 0 | M42: 0 | N42: 0 | O42: 0 | P42: =IF(AND(RC[-14]=TRUE, RC[-13]=TRUE, RC[-12] =TRUE),TRUE,FALSE) -> 0 | Q42: =IF(AND(RC[-15]=TRUE,RC[-12]=TRUE),TRUE, FALSE) -> 0
A43: Heidi Jimenez | B43: 0 | C43: 0 | D43: 0 | E43: 0 | F43: 0 | G43: 0 | H43: 0 | I43: 0 | J43: 0 | K43: 0 | L43: 0 | M43: 0 | N43: 0 | O43: 0 | P43: =IF(AND(RC[-14]=TRUE, RC[-13]=TRUE, RC[-12] =TRUE),TRUE,FALSE) -> 0 | Q43: =IF(AND(RC[-15]=TRUE,RC[-12]=TRUE),TRUE, FALSE) -> 0
A44: Annette Young | B44: 0 | C44: 0 | D44: 0 | E44: 0 | F44: 0 | G44: 0 | H44: 0 | I44: 0 | J44: 0 | K44: 0 | L44: 0 | M44: 0 | N44: 0 | O44: 0 | P44: =IF(AND(RC[-14]=TRUE, RC[-13]=TRUE, RC[-12] =TRUE),TRUE,FALSE) -> 0 | Q44: =IF(AND(RC[-15]=TRUE,RC[-12]=TRUE),TRUE, FALSE) -> 0
A45: Mr. Austin Harvey | B45: 0 | C45: 0 | D45: 0 | E45: 0 | F45: 0 | G45: 0 | H45: 0 | I45: 0 | J45: 0 | K45: 0 | L45: 0 | M45: 0 | N45: 0 | O45: 0 | P45: =IF(AND(RC[-14]=TRUE, RC[-13]=TRUE, RC[-12] =TRUE),TRUE,FALSE) -> 0 | Q45: =IF(AND(RC[-15]=TRUE,RC[-12]=TRUE),TRUE, FALSE) -> 0
A46: Willie Matthews | B46: 1 | C46: 0 | D46: 0 | E46: 0 | F46: 0 | G46: 0 | H46: 0 | I46: 1 | J46: 0 | K46: 0 | L46: 0 | M46: 0 | N46: 1 | O46: 0 | P46: =IF(AND(RC[-14]=TRUE, RC[-13]=TRUE, RC[-12] =TRUE),TRUE,FALSE) -> 0 | Q46: =IF(AND(RC[-15]=TRUE,RC[-12]=TRUE),TRUE, FALSE) -> 0
A47: Justin Hayes | B47: 0 | C47: 0 | D47: 0 | E47: 0 | F47: 0 | G47: 0 | H47: 0 | I47: 0 | J47: 0 | K47: 0 | L47: 0 | M47: 0 | N47: 0 | O47: 0 | P47: =IF(AND(RC[-14]=TRUE, RC[-13]=TRUE, RC[-12] =TRUE),TRUE,FALSE) -> 0 | Q47: =IF(AND(RC[-15]=TRUE,RC[-12]=TRUE),TRUE, FALSE) -> 0
A48: Brenda Spencer | B48: 1 | C48: 0 | D48: 0 | E48: 0 | F48: 0 | G48: 0 | H48: 0 | I48: 1 | J48: 0 | K48: 0 | L48: 0 | M48: 0 | N48: 1 | O48: 0 | P48: =IF(AND(RC[-14]=TRUE, RC[-13]=TRUE, RC[-12] =TRUE),TRUE,FALSE) -> 0 | Q48: =IF(AND(RC[-15]=TRUE,RC[-12]=TRUE),TRUE, FALSE) -> 0
A49: Edward Sullivan | B49: 0 | C49: 0 | D49: 0 | E49: 0 | F49: 0 | G49: 0 | H49: 0 | I49: 0 | J49: 0 | K49: 0 | L49: 0 | M49: 0 | N49: 0 | O49: 0 | P49: =IF(AND(RC[-14]=TRUE, RC[-13]=TRUE, RC[-12] =TRUE),TRUE,FALSE) -> 0 | Q49: =IF(AND(RC[-15]=TRUE,RC[-12]=TRUE),TRUE, FALSE) -> 0
A50: Kayla Chavez | B50: 0 | C50: 0 | D50: 0 | E50: 0 | F50: 0 | G50: 0 | H50: 0 | I50: 0 | J50: 0 | K50: 0 | L50: 0 | M50: 0 | N50: 0 | O50: 0 | P50: =IF(AND(RC[-14]=TRUE, RC[-13]=TRUE, RC[-12] =TRUE),TRUE,FALSE) -> 0 | Q50: =IF(AND(RC[-15]=TRUE,RC[-12]=TRUE),TRUE, FALSE) -> 0
A51: Erin Guerra | B51: 0 | C51: 0 | D51: 0 | E51: 0 | F51: 0 | G51: 0 | H51: 0 | I51: 0 | J51: 0 | K51: 0 | L51: 0 | M51: 0 | N51: 0 | O51: 0 | P51: =IF(AND(RC[-14]=TRUE, RC[-13]=TRUE, RC[-12] =TRUE),TRUE,FALSE) -> 0 | Q51: =IF(AND(RC[-15]=TRUE,RC[-12]=TRUE),TRUE, FALSE) -> 0
A52: Andrew Sullivan | B52: 0 | C52: 0 | D52: 0 | E52: 0 | F52: 0 | G52: 0 | H52: 0 | I52: 0 | J52: 0 | K52: 0 | L52: 0 | M52: 0 | N52: 0 | O52: 0 | P52: =IF(AND(RC[-14]=TRUE, RC[-13]=TRUE, RC[-12] =TRUE),TRUE,FALSE) -> 0 | Q52: =IF(AND(RC[-15]=TRUE,RC[-12]=TRUE),TRUE, FALSE) -> 0
A53: Miguel Jenkins DDS | B53: 1 | C53: 0 | D53: 1 | E53: 1 | F53: 0 | G53: 1 | H53: 0 | I53: 1 | J53: 1 | K53: 1 | L53: 1 | M53: 1 | N53: 0 | O53: 0 | P53: =IF(AND(RC[-14]=TRUE, RC[-13]=TRUE, RC[-12] =TRUE),TRUE,FALSE) -> 0 | Q53: =IF(AND(RC[-15]=TRUE,RC[-12]=TRUE),TRUE, FALSE) -> 1
A54: Jennifer Sandoval | B54: 1 | C54: 1 | D54: 1 | E54: 1 | F54: 1 | G54: 1 | H54: 1 | I54: 0 | J54: 0 | K54: 0 | L54: 1 | M54: 1 | N54: 0 | O54: 0 | P54: =IF(AND(RC[-14]=TRUE, RC[-13]=TRUE, RC[-12] =TRUE),TRUE,FALSE) -> 1 | Q54: =IF(AND(RC[-15]=TRUE,RC[-12]=TRUE),TRUE, FALSE) -> 1
A55: Brandon Gonzalez | B55: 1 | C55: 0 | D55: 0 | E55: 0 | F55: 0 | G55: 0 | H55: 0 | I55: 1 | J55: 0 | K55: 0 | L55: 0 | M55: 0 | N55: 1 | O55: 0 | P55: =IF(AND(RC[-14]=TRUE, RC[-13]=TRUE, RC[-12] =TRUE),TRUE,FALSE) -> 0 | Q55: =IF(AND(RC[-15]=TRUE,RC[-12]=TRUE),TRUE, FALSE) -> 0
A56: Heather Daugherty | B56: 1 | C56: 0 | D56: 0 | E56: 0 | F56: 0 | G56: 0 | H56: 0 | I56: 1 | J56: 0 | K56: 0 | L56: 0 | M56: 0 | N56: 1 | O56: 0 | P56: =IF(AND(RC[-14]=TRUE, RC[-13]=TRUE, RC[-12] =TRUE),TRUE,FALSE) -> 0 | Q56: =IF(AND(RC[-15]=TRUE,RC[-12]=TRUE),TRUE, FALSE) -> 0
A57: William Smith | B57: 0 | C57: 0 | D57: 0 | E57: 0 | F57: 0 | G57: 0 | H57: 0 | I57: 0 | J57: 0 | K57: 0 | L57: 0 | M57: 0 | N57: 0 | O57: 0 | P57: =IF(AND(RC[-14]=TRUE, RC[-13]=TRUE, RC[-12] =TRUE),TRUE,FALSE) -> 0 | Q57: =IF(AND(RC[-15]=TRUE,RC[-12]=TRUE),TRUE, FALSE) -> 0
A58: Ashley Campbell | B58: 0 | C58: 1 | D58: 0 | E58: 0 | F58: 0 | G58: 0 | H58: 0 | I58: 0 | J58: 0 | K58: 0 | L58: 0 | M58: 0 | N58: 0 | O58: 0 | P58: =IF(AND(RC[-14]=TRUE, RC[-13]=TRUE, RC[-12] =TRUE),TRUE,FALSE) -> 0 | Q58: =IF(AND(RC[-15]=TRUE,RC[-12]=TRUE),TRUE, FALSE) -> 0
A59: Troy Marquez | B59: 1 | C59: 0 | D59: 1 | E59: 1 | F59: 0 | G59: 1 | H59: 0 | I59: 1 | J59: 1 | K59: 1 | L59: 1 | M59: 1 | N59: 0 | O59: 0 | P59: =IF(AND(RC[-14]=TRUE, RC[-13]=TRUE, RC[-12] =TRUE),TRUE,FALSE) -> 0 | Q59: =IF(AND(RC[-15]=TRUE,RC[-12]=TRUE),TRUE, FALSE) -> 1
A60: Christopher Taylor | B60: 0 | C60: 0 | D60: 0 | E60: 0 | F60: 0 | G60: 0 | H60: 0 | I60: 0 | J60: 0 | K60: 0 | L60: 0 | M60: 0 | N60: 0 | O60: 0 | P60: =IF(AND(RC[-14]=TRUE, RC[-13]=TRUE, RC[-12] =TRUE),TRUE,FALSE) -> 0 | Q60: =IF(AND(RC[-15]=TRUE,RC[-12]=TRUE),TRUE, FALSE) -> 0
A61: Mrs. Julia Hancock MD | B61: 1 | C61: 0 | D61: 0 | E61: 0 | F61: 0 | G61: 0 | H61: 0 | I61: 1 | J61: 0 | K61: 0 | L61: 0 | M61: 0 | N61: 1 | O61: 0 | P61: =IF(AND(RC[-14]=TRUE, RC[-13]=TRUE, RC[-12] =TRUE),TRUE,FALSE) -> 0 | Q61: =IF(AND(RC[-15]=TRUE,RC[-12]=TRUE),TRUE, FALSE) -> 0
A62: Lindsey Collins | B62: 0 | C62: 0 | D62: 0 | E62: 0 | F62: 0 | G62: 0 | H62: 0 | I62: 0 | J62: 0 | K62: 0 | L62: 0 | M62: 0 | N62: 0 | O62: 0 | P62: =IF(AND(RC[-14]=TRUE, RC[-13]=TRUE, RC[-12] =TRUE),TRUE,FALSE) -> 0 | Q62: =IF(AND(RC[-15]=TRUE,RC[-12]=TRUE),TRUE, FALSE) -> 0
A63: Kelly Barnett | B63: 0 | C63: 0 | D63: 0 | E63: 0 | F63: 0 | G63: 0 | H63: 0 | I63: 0 | J63: 0 | K63: 0 | L63: 0 | M63: 0 | N63: 0 | O63: 0 | P63: =IF(AND(RC[-14]=TRUE, RC[-13]=TRUE, RC[-12] =TRUE),TRUE,FALSE) -> 0 | Q63: =IF(AND(RC[-15]=TRUE,RC[-12]=TRUE),TRUE, FALSE) -> 0
A64: Jared Palmer III | B64: 1 | C64: 1 | D64: 1 | E64: 1 | F64: 1 | G64: 1 | H64: 1 | I64: 0 | J64: 0 | K64: 0 | L64: 1 | M64: 1 | N64: 0 | O64: 0 | P64: =IF(AND(RC[-14]=TRUE, RC[-13]=TRUE, RC[-12] =TRUE),TRUE,FALSE) -> 1 | Q64: =IF(AND(RC[-15]=TRUE,RC[-12]=TRUE),TRUE, FALSE) -> 1
A65: Abigail Washington | B65: 0 | C65: 1 | D65: 0 | E65: 0 | F65: 0 | G65: 0 | H65: 0 | I65: 0 | J65: 0 | K65: 0 | L65: 0 | M65: 0 | N65: 0 | O65: 0 | P65: =IF(AND(RC[-14]=TRUE, RC[-13]=TRUE, RC[-12] =TRUE),TRUE,FALSE) -> 0 | Q65: =IF(AND(RC[-15]=TRUE,RC[-12]=TRUE),TRUE, FALSE) -> 0
A66: Brittany Evans | B66: 0 | C66: 0 | D66: 0 | E66: 0 | F66: 0 | G66: 0 | H66: 0 | I66: 0 | J66: 0 | K66: 0 | L66: 0 | M66: 0 | N66: 0 | O66: 0 | P66: =IF(AND(RC[-14]=TRUE, RC[-13]=TRUE, RC[-12] =TRUE),TRUE,FALSE) -> 0 | Q66: =IF(AND(RC[-15]=TRUE,RC[-12]=TRUE),TRUE, FALSE) -> 0
A67: Shawna Campbell | B67: 0 | C67: 1 | D67: 0 | E67: 0 | F67: 0 | G67: 0 | H67: 0 | I67: 0 | J67: 0 | K67: 0 | L67: 0 | M67: 0 | N67: 0 | O67: 0 | P67: =IF(AND(RC[-14]=TRUE, RC[-13]=TRUE, RC[-12] =TRUE),TRUE,FALSE) -> 0 | Q67: =IF(AND(RC[-15]=TRUE,RC[-12]=TRUE),TRUE, FALSE) -> 0
A68: Brenda Keller | B68: 0 | C68: 0 | D68: 0 | E68: 0 | F68: 0 | G68: 0 | H68: 0 | I68: 0 | J68: 0 | K68: 0 | L68: 0 | M68: 0 | N68: 0 | O68: 0 | P68: =IF(AND(RC[-14]=TRUE, RC[-13]=TRUE, RC[-12] =TRUE),TRUE,FALSE) -> 0 | Q68: =IF(AND(RC[-15]=TRUE,RC[-12]=TRUE),TRUE, FALSE) -> 0
A69: Melissa Buck | B69: 1 | C69: 0 | D69: 1 | E69: 1 | F69: 0 | G69: 1 | H69: 0 | I69: 1 | J69: 1 | K69: 1 | L69: 1 | M69: 1 | N69: 0 | O69: 0 | P69: =IF(AND(RC[-14]=TRUE, RC[-13]=TRUE, RC[-12] =TRUE),TRUE,FALSE) -> 0 | Q69: =IF(AND(RC[-15]=TRUE,RC[-12]=TRUE),TRUE, FALSE) -> 1
A70: Michael Wright | B70: 1 | C70: 1 | D70: 1 | E70: 0 | F70: 1 | G70: 1 | H70: 0 | I70: 0 | J70: 0 | K70: 0 | L70: 1 | M70: 0 | N70: 0 | O70: 0 | P70: =IF(AND(RC[-14]=TRUE, RC[-13]=TRUE, RC[-12] =TRUE),TRUE,FALSE) -> 1 | Q70: =IF(AND(RC[-15]=TRUE,RC[-12]=TRUE),TRUE, FALSE) -> 0
A71: Richard Gonzales | B71: 0 | C71: 0 | D71: 0 | E71: 0 | F71: 0 | G71: 0 | H71: 0 | I71: 0 | J71: 0 | K71: 0 | L71: 0 | M71: 0 | N71: 0 | O71: 0 | P71: =IF(AND(RC[-14]=TRUE, RC[-13]=TRUE, RC[-12] =TRUE),TRUE,FALSE) -> 0 | Q71: =IF(AND(RC[-15]=TRUE,RC[-12]=TRUE),TRUE, FALSE) -> 0
A72: Christina Stein | B72: 1 | C72: 0 | D72: 0 | E72: 0 | F72: 0 | G72: 0 | H72: 0 | I72: 1 | J72: 0 | K72: 0 | L72: 0 | M72: 0 | N72: 1 | O72: 0 | P72: =IF(AND(RC[-14]=TRUE, RC[-13]=TRUE, RC[-12] =TRUE),TRUE,FALSE) -> 0 | Q72: =IF(AND(RC[-15]=TRUE,RC[-12]=TRUE),TRUE, FALSE) -> 0
A73: Shane Thompson | B73: 1 | C73: 0 | D73: 0 | E73: 0 | F73: 0 | G73: 0 | H73: 0 | I73: 1 | J73: 0 | K73: 0 | L73: 0 | M73: 0 | N73: 1 | O73: 0 | P73: =IF(AND(RC[-14]=TRUE, RC[-13]=TRUE, RC[-12] =TRUE),TRUE,FALSE) -> 0 | Q73: =IF(AND(RC[-15]=TRUE,RC[-12]=TRUE),TRUE, FALSE) -> 0
A74: Michele Smith | B74: 0 | C74: 0 | D74: 0 | E74: 0 | F74: 0 | G74: 0 | H74: 0 | I74: 0 | J74: 0 | K74: 0 | L74: 0 | M74: 0 | N74: 0 | O74: 0 | P74: =IF(AND(RC[-14]=TRUE, RC[-13]=TRUE, RC[-12] =TRUE),TRUE,FALSE) -> 0 | Q74: =IF(AND(RC[-15]=TRUE,RC[-12]=TRUE),TRUE, FALSE) -> 0
A75: Gregory Holland | B75: 1 | C75: 1 | D75: 1 | E75: 0 | F75: 1 | G75: 1 | H75: 0 | I75: 0 | J75: 0 | K75: 0 | L75: 1 | M75: 0 | N75: 0 | O75: 0 | P75: =IF(AND(RC[-14]=TRUE, RC[-13]=TRUE, RC[-12] =TRUE),TRUE,FALSE) -> 1 | Q75: =IF(AND(RC[-15]=TRUE,RC[-12]=TRUE),TRUE, FALSE) -> 0
A76: Steven Mercer | B76: 0 | C76: 0 | D76: 0 | E76: 0 | F76: 0 | G76: 0 | H76: 0 | I76: 0 | J76: 0 | K76: 0 | L76: 0 | M76: 0 | N76: 0 | O76: 0 | P76: =IF(AND(RC[-14]=TRUE, RC[-13]=TRUE, RC[-12] =TRUE),TRUE,FALSE) -> 0 | Q76: =IF(AND(RC[-15]=TRUE,RC[-12]=TRUE),TRUE, FALSE) -> 0
A77: Brandy Kelly | B77: 0 | C77: 0 | D77: 0 | E77: 0 | F77: 0 | G77: 0 | H77: 0 | I77: 0 | J77: 0 | K77: 0 | L77: 0 | M77: 0 | N77: 0 | O77: 0 | P77: =IF(AND(RC[-14]=TRUE, RC[-13]=TRUE, RC[-12] =TRUE),TRUE,FALSE) -> 0 | Q77: =IF(AND(RC[-15]=TRUE,RC[-12]=TRUE),TRUE, FALSE) -> 0
A78: Kimberly Henry | B78: 0 | C78: 0 | D78: 0 | E78: 0 | F78: 0 | G78: 0 | H78: 0 | I78: 0 | J78: 0 | K78: 0 | L78: 0 | M78: 0 | N78: 0 | O78: 0 | P78: =IF(AND(RC[-14]=TRUE, RC[-13]=TRUE, RC[-12] =TRUE),TRUE,FALSE) -> 0 | Q78: =IF(AND(RC[-15]=TRUE,RC[-12]=TRUE),TRUE, FALSE) -> 0
A79: Amber Blake | B79: 1 | C79: 0 | D79: 1 | E79: 0 | F79: 0 | G79: 1 | H79: 0 | I79: 1 | J79: 1 | K79: 0 | L79: 1 | M79: 0 | N79: 0 | O79: 0 | P79: =IF(AND(RC[-14]=TRUE, RC[-13]=TRUE, RC[-12] =TRUE),TRUE,FALSE) -> 0 | Q79: =IF(AND(RC[-15]=TRUE,RC[-12]=TRUE),TRUE, FALSE) -> 0
A80: Roy Anderson | B80: 1 | C80: 0 | D80: 0 | E80: 0 | F80: 0 | G80: 0 | H80: 0 | I80: 1 | J80: 0 | K80: 0 | L80: 0 | M80: 0 | N80: 1 | O80: 0 | P80: =IF(AND(RC[-14]=TRUE, RC[-13]=TRUE, RC[-12] =TRUE),TRUE,FALSE) -> 0 | Q80: =IF(AND(RC[-15]=TRUE,RC[-12]=TRUE),TRUE, FALSE) -> 0
A81: Tina Lang | B81: 1 | C81: 1 | D81: 0 | E81: 0 | F81: 1 | G81: 0 | H81: 0 | I81: 0 | J81: 0 | K81: 0 | L81: 0 | M81: 0 | N81: 1 | O81: 0 | P81: =IF(AND(RC[-14]=TRUE, RC[-13]=TRUE, RC[-12] =TRUE),TRUE,FALSE) -> 0 | Q81: =IF(AND(RC[-15]=TRUE,RC[-12]=TRUE),TRUE, FALSE) -> 0
A82: Amanda Taylor | B82: 0 | C82: 0 | D82: 0 | E82: 0 | F82: 0 | G82: 0 | H82: 0 | I82: 0 | J82: 0 | K82: 0 | L82: 0 | M82: 0 | N82: 0 | O82: 0 | P82: =IF(AND(RC[-14]=TRUE, RC[-13]=TRUE, RC[-12] =TRUE),TRUE,FALSE) -> 0 | Q82: =IF(AND(RC[-15]=TRUE,RC[-12]=TRUE),TRUE, FALSE) -> 0
A83: Jill Hopkins | B83: 1 | C83: 1 | D83: 1 | E83: 0 | F83: 1 | G83: 1 | H83: 0 | I83: 0 | J83: 0 | K83: 0 | L83: 1 | M83: 0 | N83: 0 | O83: 0 | P83: =IF(AND(RC[-14]=TRUE, RC[-13]=TRUE, RC[-12] =TRUE),TRUE,FALSE) -> 1 | Q83: =IF(AND(RC[-15]=TRUE,RC[-12]=TRUE),TRUE, FALSE) -> 0
A84: Brooke Castro | B84: 0 | C84: 0 | D84: 0 | E84: 0 | F84: 0 | G84: 0 | H84: 0 | I84: 0 | J84: 0 | K84: 0 | L84: 0 | M84: 0 | N84: 0 | O84: 0 | P84: =IF(AND(RC[-14]=TRUE, RC[-13]=TRUE, RC[-12] =TRUE),TRUE,FALSE) -> 0 | Q84: =IF(AND(RC[-15]=TRUE,RC[-12]=TRUE),TRUE, FALSE) -> 0
A85: James Monroe | B85: 0 | C85: 1 | D85: 0 | E85: 0 | F85: 0 | G85: 0 | H85: 0 | I85: 0 | J85: 0 | K85: 0 | L85: 0 | M85: 0 | N85: 0 | O85: 0 | P85: =IF(AND(RC[-14]=TRUE, RC[-13]=TRUE, RC[-12] =TRUE),TRUE,FALSE) -> 0 | Q85: =IF(AND(RC[-15]=TRUE,RC[-12]=TRUE),TRUE, FALSE) -> 0
A86: Destiny Wise | B86: 0 | C86: 1 | D86: 0 | E86: 0 | F86: 0 | G86: 0 | H86: 0 | I86: 0 | J86: 0 | K86: 0 | L86: 0 | M86: 0 | N86: 0 | O86: 0 | P86: =IF(AND(RC[-14]=TRUE, RC[-13]=TRUE, RC[-12] =TRUE),TRUE,FALSE) -> 0 | Q86: =IF(AND(RC[-15]=TRUE,RC[-12]=TRUE),TRUE, FALSE) -> 0
A87: Sharon Williams | B87: 0 | C87: 0 | D87: 0 | E87: 0 | F87: 0 | G87: 0 | H87: 0 | I87: 0 | J87: 0 | K87: 0 | L87: 0 | M87: 0 | N87: 0 | O87: 0 | P87: =IF(AND(RC[-14]=TRUE, RC[-13]=TRUE, RC[-12] =TRUE),TRUE,FALSE) -> 0 | Q87: =IF(AND(RC[-15]=TRUE,RC[-12]=TRUE),TRUE, FALSE) -> 0
A88: Hannah Hunter | B88: 1 | C88: 1 | D88: 1 | E88: 1 | F88: 1 | G88: 1 | H88: 1 | I88: 0 | J88: 0 | K88: 0 | L88: 1 | M88: 1 | N88: 0 | O88: 0 | P88: =IF(AND(RC[-14]=TRUE, RC[-13]=TRUE, RC[-12] =TRUE),TRUE,FALSE) -> 1 | Q88: =IF(AND(RC[-15]=TRUE,RC[-12]=TRUE),TRUE, FALSE) -> 1
A89: Heather Graham | B89: 0 | C89: 0 | D89: 0 | E89: 0 | F89: 0 | G89: 0 | H89: 0 | I89: 0 | J89: 0 | K89: 0 | L89: 0 | M89: 0 | N89: 0 | O89: 0 | P89: =IF(AND(RC[-14]=TRUE, RC[-13]=TRUE, RC[-12] =TRUE),TRUE,FALSE) -> 0 | Q89: =IF(AND(RC[-15]=TRUE,RC[-12]=TRUE),TRUE, FALSE) -> 0
A90: Jasmine Kelly | B90: 0 | C90: 0 | D90: 0 | E90: 1 | F90: 0 | G90: 0 | H90: 0 | I90: 0 | J90: 0 | K90: 1 | L90: 0 | M90: 0 | N90: 0 | O90: 1 | P90: =IF(AND(RC[-14]=TRUE, RC[-13]=TRUE, RC[-12] =TRUE),TRUE,FALSE) -> 0 | Q90: =IF(AND(RC[-15]=TRUE,RC[-12]=TRUE),TRUE, FALSE) -> 0
A91: Benjamin Durham | B91: 0 | C91: 0 | D91: 1 | E91: 1 | F91: 0 | G91: 0 | H91: 0 | I91: 0 | J91: 1 | K91: 1 | L91: 0 | M91: 1 | N91: 0 | O91: 0 | P91: =IF(AND(RC[-14]=TRUE, RC[-13]=TRUE, RC[-12] =TRUE),TRUE,FALSE) -> 0 | Q91: =IF(AND(RC[-15]=TRUE,RC[-12]=TRUE),TRUE, FALSE) -> 0
A92: Ronald Taylor | B92: 0 | C92: 0 | D92: 0 | E92: 0 | F92: 0 | G92: 0 | H92: 0 | I92: 0 | J92: 0 | K92: 0 | L92: 0 | M92: 0 | N92: 0 | O92: 0 | P92: =IF(AND(RC[-14]=TRUE, RC[-13]=TRUE, RC[-12] =TRUE),TRUE,FALSE) -> 0 | Q92: =IF(AND(RC[-15]=TRUE,RC[-12]=TRUE),TRUE, FALSE) -> 0
A93: Joanna Lee | B93: 0 | C93: 0 | D93: 0 | E93: 0 | F93: 0 | G93: 0 | H93: 0 | I93: 0 | J93: 0 | K93: 0 | L93: 0 | M93: 0 | N93: 0 | O93: 0 | P93: =IF(AND(RC[-14]=TRUE, RC[-13]=TRUE, RC[-12] =TRUE),TRUE,FALSE) -> 0 | Q93: =IF(AND(RC[-15]=TRUE,RC[-12]=TRUE),TRUE, FALSE) -> 0
A94: Megan Padilla | B94: 0 | C94: 0 | D94: 0 | E94: 0 | F94: 0 | G94: 0 | H94: 0 | I94: 0 | J94: 0 | K94: 0 | L94: 0 | M94: 0 | N94: 0 | O94: 0 | P94: =IF(AND(RC[-14]=TRUE, RC[-13]=TRUE, RC[-12] =TRUE),TRUE,FALSE) -> 0 | Q94: =IF(AND(RC[-15]=TRUE,RC[-12]=TRUE),TRUE, FALSE) -> 0
A95: Manuel Keith | B95: 1 | C95: 1 | D95: 0 | E95: 1 | F95: 1 | G95: 0 | H95: 1 | I95: 0 | J95: 0 | K95: 0 | L95: 0 | M95: 0 | N95: 1 | O95: 1 | P95: =IF(AND(RC[-14]=TRUE, RC[-13]=TRUE, RC[-12] =TRUE),TRUE,FALSE) -> 0 | Q95: =IF(AND(RC[-15]=TRUE,RC[-12]=TRUE),TRUE, FALSE) -> 1
A96: Mrs. Susan Middleton | B96: 0 | C96: 0 | D96: 0 | E96: 0 | F96: 0 | G96: 0 | H96: 0 | I96: 0 | J96: 0 | K96: 0 | L96: 0 | M96: 0 | N96: 0 | O96: 0 | P96: =IF(AND(RC[-14]=TRUE, RC[-13]=TRUE, RC[-12] =TRUE),TRUE,FALSE) -> 0 | Q96: =IF(AND(RC[-15]=TRUE,RC[-12]=TRUE),TRUE, FALSE) -> 0
A97: Larry Kline | B97: 1 | C97: 0 | D97: 0 | E97: 1 | F97: 0 | G97: 0 | H97: 0 | I97: 1 | J97: 0 | K97: 1 | L97: 0 | M97: 0 | N97: 1 | O97: 1 | P97: =IF(AND(RC[-14]=TRUE, RC[-13]=TRUE, RC[-12] =TRUE),TRUE,FALSE) -> 0 | Q97: =IF(AND(RC[-15]=TRUE,RC[-12]=TRUE),TRUE, FALSE) -> 1
A98: Maria Taylor | B98: 0 | C98: 0 | D98: 0 | E98: 0 | F98: 0 | G98: 0 | H98: 0 | I98: 0 | J98: 0 | K98: 0 | L98: 0 | M98: 0 | N98: 0 | O98: 0 | P98: =IF(AND(RC[-14]=TRUE, RC[-13]=TRUE, RC[-12] =TRUE),TRUE,FALSE) -> 0 | Q98: =IF(AND(RC[-15]=TRUE,RC[-12]=TRUE),TRUE, FALSE) -> 0
A99: Joshua Bonilla | B99: 0 | C99: 0 | D99: 0 | E99: 0 | F99: 0 | G99: 0 | H99: 0 | I99: 0 | J99: 0 | K99: 0 | L99: 0 | M99: 0 | N99: 0 | O99: 0 | P99: =IF(AND(RC[-14]=TRUE, RC[-13]=TRUE, RC[-12] =TRUE),TRUE,FALSE) -> 0 | Q99: =IF(AND(RC[-15]=TRUE,RC[-12]=TRUE),TRUE, FALSE) -> 0
A100: Brandon Simpson | B100: 0 | C100: 0 | D100: 0 | E100: 0 | F100: 0 | G100: 0 | H100: 0 | I100: 0 | J100: 0 | K100: 0 | L100: 0 | M100: 0 | N100: 0 | O100: 0 | P100: =IF(AND(RC[-14]=TRUE, RC[-13]=TRUE, RC[-12] =TRUE),TRUE,FALSE) -> 0 | Q100: =IF(AND(RC[-15]=TRUE,RC[-12]=TRUE),TRUE, FALSE) -> 0
A101: Brenda Griffith | B101: 1 | C101: 1 | D101: 0 | E101: 1 | F101: 1 | G101: 0 | H101: 1 | I101: 0 | J101: 0 | K101: 0 | L101: 0 | M101: 0 | N101: 1 | O101: 1 | P101: =IF(AND(RC[-14]=TRUE, RC[-13]=TRUE, RC[-12] =TRUE),TRUE,FALSE) -> 0 | Q101: =IF(AND(RC[-15]=TRUE,RC[-12]=TRUE),TRUE, FALSE) -> 1
A102: Deborah Jones | B102: 1 | C102: 0 | D102: 0 | E102: 1 | F102: 0 | G102: 0 | H102: 0 | I102: 1 | J102: 0 | K102: 1 | L102: 0 | M102: 0 | N102: 1 | O102: 1 | P102: =IF(AND(RC[-14]=TRUE, RC[-13]=TRUE, RC[-12] =TRUE),TRUE,FALSE) -> 0 | Q102: =IF(AND(RC[-15]=TRUE,RC[-12]=TRUE),TRUE, FALSE) -> 1
A103: Jennifer Osborn | B103: 0 | C103: 0 | D103: 0 | E103: 0 | F103: 0 | G103: 0 | H103: 0 | I103: 0 | J103: 0 | K103: 0 | L103: 0 | M103: 0 | N103: 0 | O103: 0 | P103: =IF(AND(RC[-14]=TRUE, RC[-13]=TRUE, RC[-12] =TRUE),TRUE,FALSE) -> 0 | Q103: =IF(AND(RC[-15]=TRUE,RC[-12]=TRUE),TRUE, FALSE) -> 0
A104: Andrew Riley | B104: 0 | C104: 0 | D104: 0 | E104: 0 | F104: 0 | G104: 0 | H104: 0 | I104: 0 | J104: 0 | K104: 0 | L104: 0 | M104: 0 | N104: 0 | O104: 0 | P104: =IF(AND(RC[-14]=TRUE, RC[-13]=TRUE, RC[-12] =TRUE),TRUE,FALSE) -> 0 | Q104: =IF(AND(RC[-15]=TRUE,RC[-12]=TRUE),TRUE, FALSE) -> 0
A105: Wesley Jordan | B105: 0 | C105: 1 | D105: 1 | E105: 0 | F105: 0 | G105: 0 | H105: 0 | I105: 0 | J105: 0 | K105: 0 | L105: 0 | M105: 0 | N105: 0 | O105: 0 | P105: =IF(AND(RC[-14]=TRUE, RC[-13]=TRUE, RC[-12] =TRUE),TRUE,FALSE) -> 0 | Q105: =IF(AND(RC[-15]=TRUE,RC[-12]=TRUE),TRUE, FALSE) -> 0
A106: Christopher Davis | B106: 1 | C106: 1 | D106: 1 | E106: 0 | F106: 1 | G106: 1 | H106: 0 | I106: 0 | J106: 0 | K106: 0 | L106: 1 | M106: 0 | N106: 0 | O106: 0 | P106: =IF(AND(RC[-14]=TRUE, RC[-13]=TRUE, RC[-12] =TRUE),TRUE,FALSE) -> 1 | Q106: =IF(AND(RC[-15]=TRUE,RC[-12]=TRUE),TRUE, FALSE) -> 0
A107: Sarah Hernandez | B107: 1 | C107: 1 | D107: 0 | E107: 0 | F107: 1 | G107: 0 | H107: 0 | I107: 0 | J107: 0 | K107: 0 | L107: 0 | M107: 0 | N107: 1 | O107: 0 | P107: =IF(AND(RC[-14]=TRUE, RC[-13]=TRUE, RC[-12] =TRUE),TRUE,FALSE) -> 0 | Q107: =IF(AND(RC[-15]=TRUE,RC[-12]=TRUE),TRUE, FALSE) -> 0
A108: Brenda Leonard | B108: 1 | C108: 1 | D108: 0 | E108: 0 | F108: 1 | G108: 0 | H108: 0 | I108: 0 | J108: 0 | K108: 0 | L108: 0 | M108: 0 | N108: 1 | O108: 0 | P108: =IF(AND(RC[-14]=TRUE, RC[-13]=TRUE, RC[-12] =TRUE),TRUE,FALSE) -> 0 | Q108: =IF(AND(RC[-15]=TRUE,RC[-12]=TRUE),TRUE, FALSE) -> 0
A109: Adriana Robinson | B109: 1 | C109: 0 | D109: 0 | E109: 0 | F109: 0 | G109: 0 | H109: 0 | I109: 1 | J109: 0 | K109: 0 | L109: 0 | M109: 0 | N109: 1 | O109: 0 | P109: =IF(AND(RC[-14]=TRUE, RC[-13]=TRUE, RC[-12] =TRUE),TRUE,FALSE) -> 0 | Q109: =IF(AND(RC[-15]=TRUE,RC[-12]=TRUE),TRUE, FALSE) -> 0
A110: Kristen Johnson | B110: 1 | C110: 0 | D110: 0 | E110: 0 | F110: 0 | G110: 0 | H110: 0 | I110: 1 | J110: 0 | K110: 0 | L110: 0 | M110: 0 | N110: 1 | O110: 0 | P110: =IF(AND(RC[-14]=TRUE, RC[-13]=TRUE, RC[-12] =TRUE),TRUE,FALSE) -> 0 | Q110: =IF(AND(RC[-15]=TRUE,RC[-12]=TRUE),TRUE, FALSE) -> 0
A111: Aaron Huff | B111: 0 | C111: 0 | D111: 0 | E111: 0 | F111: 0 | G111: 0 | H111: 0 | I111: 0 | J111: 0 | K111: 0 | L111: 0 | M111: 0 | N111: 0 | O111: 0 | P111: =IF(AND(RC[-14]=TRUE, RC[-13]=TRUE, RC[-12] =TRUE),TRUE,FALSE) -> 0 | Q111: =IF(AND(RC[-15]=TRUE,RC[-12]=TRUE),TRUE, FALSE) -> 0
A112: Barbara Murray | B112: 0 | C112: 0 | D112: 0 | E112: 0 | F112: 0 | G112: 0 | H112: 0 | I112: 0 | J112: 0 | K112: 0 | L112: 0 | M112: 0 | N112: 0 | O112: 0 | P112: =IF(AND(RC[-14]=TRUE, RC[-13]=TRUE, RC[-12] =TRUE),TRUE,FALSE) -> 0 | Q112: =IF(AND(RC[-15]=TRUE,RC[-12]=TRUE),TRUE, FALSE) -> 0
A113: Tyler Hammond | B113: 0 | C113: 0 | D113: 0 | E113: 0 | F113: 0 | G113: 0 | H113: 0 | I113: 0 | J113: 0 | K113: 0 | L113: 0 | M113: 0 | N113: 0 | O113: 0 | P113: =IF(AND(RC[-14]=TRUE, RC[-13]=TRUE, RC[-12] =TRUE),TRUE,FALSE) -> 0 | Q113: =IF(AND(RC[-15]=TRUE,RC[-12]=TRUE),TRUE, FALSE) -> 0
A114: Tracy Collins | B114: 0 | C114: 0 | D114: 0 | E114: 0 | F114: 0 | G114: 0 | H114: 0 | I114: 0 | J114: 0 | K114: 0 | L114: 0 | M114: 0 | N114: 0 | O114: 0 | P114: =IF(AND(RC[-14]=TRUE, RC[-13]=TRUE, RC[-12] =TRUE),TRUE,FALSE) -> 0 | Q114: =IF(AND(RC[-15]=TRUE,RC[-12]=TRUE),TRUE, FALSE) -> 0
A115: John Perry | B115: 0 | C115: 0 | D115: 0 | E115: 0 | F115: 0 | G115: 0 | H115: 0 | I115: 0 | J115: 0 | K115: 0 | L115: 0 | M115: 0 | N115: 0 | O115: 0 | P115: =IF(AND(RC[-14]=TRUE, RC[-13]=TRUE, RC[-12] =TRUE),TRUE,FALSE) -> 0 | Q115: =IF(AND(RC[-15]=TRUE,RC[-12]=TRUE),TRUE, FALSE) -> 0
A116: Raymond Johnson | B116: 0 | C116: 0 | D116: 0 | E116: 0 | F116: 0 | G116: 0 | H116: 0 | I116: 0 | J116: 0 | K116: 0 | L116: 0 | M116: 0 | N116: 0 | O116: 0 | P116: =IF(AND(RC[-14]=TRUE, RC[-13]=TRUE, RC[-12] =TRUE),TRUE,FALSE) -> 0 | Q116: =IF(AND(RC[-15]=TRUE,RC[-12]=TRUE),TRUE, FALSE) -> 0
A117: Amanda Duffy | B117: 0 | C117: 0 | D117: 0 | E117: 0 | F117: 0 | G117: 0 | H117: 0 | I117: 0 | J117: 0 | K117: 0 | L117: 0 | M117: 0 | N117: 0 | O117: 0 | P117: =IF(AND(RC[-14]=TRUE, RC[-13]=TRUE, RC[-12] =TRUE),TRUE,FALSE) -> 0 | Q117: =IF(AND(RC[-15]=TRUE,RC[-12]=TRUE),TRUE, FALSE) -> 0
A118: Jonathan Castro | B118: 0 | C118: 0 | D118: 0 | E118: 0 | F118: 0 | G118: 0 | H118: 0 | I118: 0 | J118: 0 | K118: 0 | L118: 0 | M118: 0 | N118: 0 | O118: 0 | P118: =IF(AND(RC[-14]=TRUE, RC[-13]=TRUE, RC[-12] =TRUE),TRUE,FALSE) -> 0 | Q118: =IF(AND(RC[-15]=TRUE,RC[-12]=TRUE),TRUE, FALSE) -> 0
A119: Lori Ruiz | B119: 0 | C119: 0 | D119: 0 | E119: 0 | F119: 0 | G119: 0 | H119: 0 | I119: 0 | J119: 0 | K119: 0 | L119: 0 | M119: 0 | N119: 0 | O119: 0 | P119: =IF(AND(RC[-14]=TRUE, RC[-13]=TRUE, RC[-12] =TRUE),TRUE,FALSE) -> 0 | Q119: =IF(AND(RC[-15]=TRUE,RC[-12]=TRUE),TRUE, FALSE) -> 0
A120: Casey Bennett | B120: 0 | C120: 0 | D120: 0 | E120: 0 | F120: 0 | G120: 0 | H120: 0 | I120: 0 | J120: 0 | K120: 0 | L120: 0 | M120: 0 | N120: 0 | O120: 0 | P120: =IF(AND(RC[-14]=TRUE, RC[-13]=TRUE, RC[-12] =TRUE),TRUE,FALSE) -> 0 | Q120: =IF(AND(RC[-15]=TRUE,RC[-12]=TRUE),TRUE, FALSE) -> 0
A121: Anna Flynn | B121: 0 | C121: 0 | D121: 0 | E121: 0 | F121: 0 | G121: 0 | H121: 0 | I121: 0 | J121: 0 | K121: 0 | L121: 0 | M121: 0 | N121: 0 | O121: 0 | P121: =IF(AND(RC[-14]=TRUE, RC[-13]=TRUE, RC[-12] =TRUE),TRUE,FALSE) -> 0 | Q121: =IF(AND(RC[-15]=TRUE,RC[-12]=TRUE),TRUE, FALSE) -> 0
I122: Probs
G123: E | H123: 30 | I123: 0.25
A124: P(E) | B124: 0.25 | G124: F | H124: 24 | I124: 0.2
A125: P(A|E) | B125: 0.63333333300000005 | G125: A | H125: 45 | I125: 0.375
A126: P(not A|E) | B126: 0.366666667 | G126: T | H126: 24 | I126: 0.2
A127: P(F|E) | B127: 0.7 | G127: A and E | H127: 19 | I127: 0.15833333299999999
A128: P(not F|E) | B128: 0.3 | G128: F and E | H128: 21 | I128: 0.17499999999999999
A129: P(T|E) | B129: 0.4 | G129: T and E | H129: 12 | I129: 0.1
A130: P(not T|E) | B130: 0.6 | G130: F and A | H130: 21 | I130: 0.17499999999999999
A131: P(A|F) | B131: 0.875 | G131: F and T | H131: 18 | I131: 0.15
A132: P(not A | F) | B132: 0.125 | G132: A and E and T | H132: =COUNTIF(R[-130]C[8]:R[-11]C[8],TRUE) -> 13 | I132: =RC[-1]/120 -> 0.10833333333333334
A133: P(T|F) | B133: 0.75 | G133: A and T | H133: =COUNTIF(R[-131]C[9]:R[-12]C[9],TRUE) -> 21 | I133: =RC[-1]/120 -> 0.17499999999999999
A134: P(not T | F) | B134: 0.25
J136: =R[-4]C[-1]/R[-3]C[-1] -> 0.61904761904761907 | L136: =R[-11]C[-3]*R[-10]C[-3] -> 7.5000000000000011E-2
A137: P(E,A) | B137: =COUNTIF(R[-135]C[4]:R[-16]C[4],TRUE)/120 -> 0.15833333333333333 | D137: =RC[-2]/R[-12]C[5] -> 0.42222222222222222 | L137: =R[-12]C[-3]+R[-11]C[-3] -> 0.57499999999999996